{"$schema":"https://json-schema.org/draft/2020-12/schema","title":"QSOL-ARK Minimum Recoverable Substrate Contract","type":"object","additionalProperties":false,"required":["type","protocol","version","tier_registry","definition","selection","failure","examples"],"properties":{"type":{"const":"qsol-ark-minimum-recoverable-substrate"},"protocol":{"const":"QSOL-ARK"},"version":{"type":"string"},"tier_registry":{"const":"ai/recovery-tiers.json"},"definition":{"type":"string","minLength":1},"selection":{"type":"array","minItems":1,"items":{"type":"string"}},"failure":{"const":"ARK_MRS_UNAVAILABLE"},"examples":{"type":"array","minItems":1,"items":{"type":"object","additionalProperties":false,"required":["requires","result"],"properties":{"requires":{"type":"array","minItems":1,"uniqueItems":true,"items":{"type":"string","minLength":1}},"result":{"anyOf":[{"type":"string","pattern":"^T[0-9]+$"},{"type":"null"}]}}}}}}
